Authors,Title,Year,Source title,Volume,Issue,Art. No.,Page start,Page end,Page count,Cited by,Link,Publisher,ISSN,ISBN,CODEN,DOI,PubMed ID,Abbreviated Source Title,Document Type,Source"Ying L., Lau A., Alvira C.M., West R., Cann G.M., Zhou B., Kinnear C., Jan E., Sarnow P., Van de Rijn M., Rabinovitch M.",LC3-mediated fibronectin mRNA translation induces fibrosarcoma growth by increasing connective tissue growth factor,2009,Journal of Cell Science,122,9,,1441,1451,,,http://www.scopus.com/inward/record.url?eid=2-s2.0-67650550211&partnerID=40&md5=ea299ecf1296d386662f8edaa8958e89,,219533,,JNCSA,10.1242/jcs.025957,19366727,Journal of Cell Science,Article,Scopus"Zhao Y., Marotta M., Eichler E.E., Eng C., Tanaka H.",Linkage disequilibrium between two high-frequency deletion polymorphisms: Implications for association studies involving the glutathione-S transferase( GST) genes,2009,PLoS Genetics,5,5, e1000472,,,,,http://www.scopus.com/inward/record.url?eid=2-s2.0-67149113583&partnerID=40&md5=2e0f8254ecc5651483d70e03c87878a2,,15537390,,,10.1371/journal.pgen.1000472,19424424,PLoS Genetics,Article,Scopus"Ollinger J., Bowen B., Wiedmann M., Boor K.J., Bergholz T.M.",Listeria monocytogenes σ<sup>B</sup> modulates PrfA-mediated virulence factor expression,2009,Infection and Immunity,77,5,,2113,2124,,3,http://www.scopus.com/inward/record.url?eid=2-s2.0-65449125448&partnerID=40&md5=ee0e916a9a3975e52d44130444354b8d,,199567,,INFIB,10.1128/IAI.01205-08,19255187,Infection and Immunity,Article,Scopus"Yuan Z., Miyoshi T., Bao Y., Sheehan J.P., Matsumoto A.H., Shi W.",Microarray analysis of gene expression in mouse aorta reveals role of the calcium signaling pathway in control of atherosclerosis susceptibility,2009,American Journal of Physiology - Heart and Circulatory Physiology,296,5,,,,,1,http://www.scopus.com/inward/record.url?eid=2-s2.0-66149103533&partnerID=40&md5=4016365ad9541acafd103097cefe4ba9,,3636135,,AJPPD,10.1152/ajpheart.01095.2008,19304945,American Journal of Physiology - Heart and Circulatory Physiology,Article,Scopus"Brooks III L., Strable J., Zhang X., Ohtsu K., Zhou R., Sarkar A., Hargreaves S., Elshire R.J., Eudy D., Pawlowska T., Ware D., Janick-Buckner D., Buckner B., Timmermans M.C.P., Schnable P.S., Nettleton D., Scanlon M.J.",Microdissection of shoot meristem functional domains,2009,PLoS Genetics,5,5, e1000476,,,,2,http://www.scopus.com/inward/record.url?eid=2-s2.0-67149128424&partnerID=40&md5=9bae271dc1ef95b84d485aec5d37f260,,15537390,,,10.1371/journal.pgen.1000476,19424435,PLoS Genetics,Article,Scopus"Liu X., Yu J., Jiang L., Wang A., Shi F., Ye H., Zhou X.",MicroRNA-222 regulates cell invasion by targeting matrix metalloproteinase 1 (MMP1) and manganese superoxide dismutase 2 (SOD2) in tongue squamous cell carcinoma cell lines,2009,Cancer Genomics and Proteomics,6,3,,134,139,,,http://www.scopus.com/inward/record.url?eid=2-s2.0-67649511946&partnerID=40&md5=943a1e340ec9db12f08018d8d9f6487e,,11096535,,,,19487542,Cancer Genomics and Proteomics,Article,Scopus"Binger T., Stich S., Andreas K., Kaps C., Sezer O., Notter M., Sittinger M., Ringe J.",Migration potential and gene expression profile of human mesenchymal stem cells induced by CCL25,2009,Experimental Cell Research,315,8,,1468,1479,,2,http://www.scopus.com/inward/record.url?eid=2-s2.0-64549161093&partnerID=40&md5=89ae5986aa14558e0ec9bf425b330854,,144827,,ECREA,10.1016/j.yexcr.2008.12.022,19168060,Experimental Cell Research,Article,Scopus"Klaassens E.S., Boesten R.J., Haarman M., Knol J., Schuren F.H., Vaughan E.E., De Vos W.M.",Mixed-species genomic microarray analysis of fecal samples reveals differential transcriptional responses of bifidobacteria in breast- And formula-fed infants,2009,Applied and Environmental Microbiology,75,9,,2668,2676,,1,http://www.scopus.com/inward/record.url?eid=2-s2.0-65549147992&partnerID=40&md5=9fc3a4bf067432991cf9e90b2dd0df89,,992240,,AEMID,10.1128/AEM.02492-08,19286790,Applied and Environmental Microbiology,Article,Scopus"Wang D., Xia X., Liu Y., Oetting A., Walker R.L., Zhu Y., Meltzer P., Cole P.A., Shi Y.-B., Yen P.M.",Negative regulation of tshα target gene by thyroid hormone involves histone acetylation and corepressor complex dissociation,2009,Molecular Endocrinology,23,5,,600,609,,2,http://www.scopus.com/inward/record.url?eid=2-s2.0-66649119535&partnerID=40&md5=a474244769a6eefff38494b5a3876f01,,8888809,,MOENE,10.1210/me.2008-0389,19196836,Molecular Endocrinology,Article,Scopus"Scotlandi K., Remondini D., Castellani G., Manara M.C., Nardi F., Cantiani L., Francesconi M., Mercuri M., Caccuri A.M., Serra M., Knuutila S., Picci P.",Overcoming resistance to conventional drugs in Ewing sarcoma and identification of molecular predictors of outcome,2009,Journal of Clinical Oncology,27,13,,2209,2216,,3,http://www.scopus.com/inward/record.url?eid=2-s2.0-65549117869&partnerID=40&md5=fa7882961e1461c0d505aa2e37e0a286,,0732183X,,JCOND,10.1200/JCO.2008.19.2542,19307502,Journal of Clinical Oncology,Article,Scopus"Gheorghe C.P., Goyal R., Holweger J.D., Longo L.D.",Placental Gene Expression Responses to Maternal Protein Restriction in the Mouse,2009,Placenta,30,5,,411,417,,1,http://www.scopus.com/inward/record.url?eid=2-s2.0-65049090005&partnerID=40&md5=cbecefcf77b1ec338c2d573288e1bedf,,1434004,,PLACD,10.1016/j.placenta.2009.03.002,19362366,Placenta,Article,Scopus"Qian D.Z., Huang C.-Y., O'Brien C.A., Coleman I.M., Garzotto M., True L.D., Higano C.S., Vessella R., Lange P.H., Nelson P.S., Beer T.M.",Prostate cancer - Associated gene expression alterations determined from needle biopsies,2009,Clinical Cancer Research,15,9,,3135,3142,,1,http://www.scopus.com/inward/record.url?eid=2-s2.0-65649149055&partnerID=40&md5=8cf2d6c3f4da8d73d231cbff8e0b1a86,,10780432,,CCREF,10.1158/1078-0432.CCR-08-1982,19366833,Clinical Cancer Research,Article,Scopus"Ehira S., Teramoto H., Inui M., Yukawa H.",Regulation of Corynebacterium glutamicum heat shock response by the extracytoplasmic-function sigma factor SigH and transcriptional regulators HspR and HrcA,2009,Journal of Bacteriology,191,9,,2964,2972,,,http://www.scopus.com/inward/record.url?eid=2-s2.0-65549101172&partnerID=40&md5=8bfa72148ea11f073c1930ae5ee9203f,,219193,,JOBAA,10.1128/JB.00112-09,19270092,Journal of Bacteriology,Article,Scopus"Poitou C., Divoux A., Faty A., Tordjman J., Hugol D., Aissat A., Keophiphath M., Henegar C., Commans S., Clement K.",Role of serum amyloid A in adipocyte-macrophage cross talk and adipocyte cholesterol efflux,2009,Journal of Clinical Endocrinology and Metabolism,94,5,,1810,1817,,1,http://www.scopus.com/inward/record.url?eid=2-s2.0-66149113349&partnerID=40&md5=2445a248462341a1ea079d7c5489c2f9,,0021972X,,JCEMA,10.1210/jc.2008-2040,19223523,Journal of Clinical Endocrinology and Metabolism,Article,Scopus"Wan Y., Saleem R.A., Ratushny A.V., Roda O., Smith J.J., Lin C.-H., Chiang J.-H., Aitchison J.D.","Role of the histone variant H2A.Z/Htz1p in TBP recruitment, chromatin dynamics, and regulated expression of oleate-responsive genes",2009,Molecular and Cellular Biology,29,9,,2346,2358,,1,http://www.scopus.com/inward/record.url?eid=2-s2.0-65449119280&partnerID=40&md5=8c7cb4769a4724e8a0db52347ef8418e,,2707306,,MCEBD,10.1128/MCB.01233-08,19273605,Molecular and Cellular Biology,Article,Scopus"Sawaki Y., Iuchi S., Kobayashi Y., Kobayashi Y., Ikka T., Sakurai N., Fujita M., Shinozaki K., Shibata D., Kobayashi M., Koyama H.",Stop1 regulates multiple genes that protect arabidopsis from proton and aluminum toxicities,2009,Plant Physiology,150,1,,281,294,,1,http://www.scopus.com/inward/record.url?eid=2-s2.0-66149095025&partnerID=40&md5=e5ae4f87d6d1141e3874a3db26883e9b,,320889,,PLPHA,10.1104/pp.108.134700,19321711,Plant Physiology,Article,Scopus"Passalacqua K.D., Varadarajan A., Ondov B.D., Okou D.T., Zwick M.E., Bergman N.H.",Structure and complexity of a bacterial transcriptome,2009,Journal of Bacteriology,191,10,,3203,3211,,8,http://www.scopus.com/inward/record.url?eid=2-s2.0-65549099632&partnerID=40&md5=7f31677debda54dbda5806f7628294aa,,219193,,JOBAA,10.1128/JB.00122-09,19304856,Journal of Bacteriology,Article,Scopus"Yamaguchi T., Kuroda M., Yamakawa H., Ashizawa T., Hirayae K., Kurimoto L., Shinya T., Shibuya N.","Suppression of a phospholipase d gene, ospldb1, activates defense responses and increases disease resistance in rice",2009,Plant Physiology,150,1,,308,319,,,http://www.scopus.com/inward/record.url?eid=2-s2.0-66149103177&partnerID=40&md5=f67be99ae3871eb0f3fc870fc19238c1,,320889,,PLPHA,10.1104/pp.108.131979,19286937,Plant Physiology,Article,Scopus"Tyagi A., Ryme J., Brodin D., Farrants A.K.O., Visa N.",SWI/SNF associates with nascent pre-mRNPs and regulates alternative pre-mRNA processing,2009,PLoS Genetics,5,5, e1000470,,,,1,http://www.scopus.com/inward/record.url?eid=2-s2.0-67149138094&partnerID=40&md5=a3f4cfcbd1bccb4ee918334f1092ee01,,15537390,,,10.1371/journal.pgen.1000470,19424417,PLoS Genetics,Article,Scopus"Way K.J., Dinh H., Keene M.R., White K.E., Clanchy F.I.L., Lusby P., Roiniotis J., Cook A.D., Cassady A.I., Curtis D.J., Hamilton J.A.",The generation and properties of human macrophage populations from hemopoietic stem cells,2009,Journal of Leukocyte Biology,85,5,,766,778,,1,http://www.scopus.com/inward/record.url?eid=2-s2.0-65549128681&partnerID=40&md5=3eb5df46d4f7903a3d2de6f8aa742356,,7415400,,JLBIE,10.1189/jlb.1108689,19181863,Journal of Leukocyte Biology,Article,Scopus"Sohn S.-H., Ko E., Jeon S.-B., Lee B.-J., Kim S.-H., Dong M.-S., Lee D.-U., Kwak J.-H., Kim Y., Shin M., Hong M., Bae H.",The genome-wide expression profile of Scrophularia ningpoensis-treated thapsigargin-stimulated U-87MG cells,2009,NeuroToxicology,30,3,,368,376,,,http://www.scopus.com/inward/record.url?eid=2-s2.0-65149086967&partnerID=40&md5=c1a3ed210ac0363b35146ae706a085e0,,0161813X,,NRTXD,10.1016/j.neuro.2009.02.006,19442820,NeuroToxicology,Article,Scopus"Knoth C., Salus M.S., Girke T., Eulgem T.","The synthetic elicitor 3,5-dichloroanthranilic acid induces NPR1-dependent and npr1-independent mechanisms of disease resistance in arabidopsis",2009,Plant Physiology,150,1,,333,347,,,http://www.scopus.com/inward/record.url?eid=2-s2.0-66149128777&partnerID=40&md5=02e32fd5d800b538e909d15b20bf451c,,320889,,PLPHA,10.1104/pp.108.133678,19304930,Plant Physiology,Article,Scopus"Evangelisti C., Astolfi A., Gaboardi G.C., Tazzari P., Pession A., Goto K., Martelli A.M.",TIS21/BTG2/PC3 and cyclin D1 are key determinants of nuclear diacylglycerol kinase-ζ-dependent cell cycle arrest,2009,Cellular Signalling,21,5,,801,809,,1,http://www.scopus.com/inward/record.url?eid=2-s2.0-60549093355&partnerID=40&md5=198fe9e02e2de3f312819d0894c19ff0,,8986568,,CESIE,10.1016/j.cellsig.2009.01.027,19263516,Cellular Signalling,Article,Scopus"Liu J., Zhang Z., Bando M., Itoh T., Deardorff M.A., Clark D., Kaur M., Tandy S., Kondoh T., Rappaport E., Spinner N.B., Vega H., Jackson L.G., Shirahige K., Krantz I.D.",Transcriptional Dysregulation in NIPBLand Cohesin Mutant Human Cells,2009,PLoS Biology,7,5, e1000119,,,,5,http://www.scopus.com/inward/record.url?eid=2-s2.0-66249144416&partnerID=40&md5=40326beed22545756139558bf292e883,,15449173,,PBLIB,10.1371/journal.pbio.1000119,19468298,PLoS Biology,Article,Scopus"Zhou H., Gong J., Brisbin J., Yu H., Sarson A.J., Si W., Sharif S., Han Y.",Transcriptional profiling analysis of host response to Clostridium perfringens infection in broilers,2009,Poultry Science,88,5,,1023,1032,,2,http://www.scopus.com/inward/record.url?eid=2-s2.0-67649211662&partnerID=40&md5=577c09da54d8051bfa9f640a546779f3,,325791,,,10.3382/ps.2008-00343,19359691,Poultry Science,Article,Scopus"Wei Z., Hu W., Lin Q., Cheng X., Tong M., Zhu L., Chen R., He G.",Understanding rice plant resistance to the Brown Planthopper (Nilaparvata lugens): A proteomic approach,2009,Proteomics,9,10,,2798,2808,,1,http://www.scopus.com/inward/record.url?eid=2-s2.0-66449134802&partnerID=40&md5=1324d7e85aa18ed0406b8aa85bf691c8,,16159853,,PROTC,10.1002/pmic.200800840,19405033,Proteomics,Article,Scopus"Price K.L., Woolf A.S., Long D.A.",Unraveling the Genetic Landscape of Bladder Development in Mice,2009,Journal of Urology,181,5,,2366,2374,,,http://www.scopus.com/inward/record.url?eid=2-s2.0-64049084265&partnerID=40&md5=bbdebb1509b81998f423920560295f34,,225347,,JOURA,10.1016/j.juro.2009.01.001,19303107,Journal of Urology,Article,Scopus"Akama T., Suzuki K., Tanigawa K., Kawashima A., Wu H., Nakata N., Osana Y., Sakakibara Y., Ishii N.",Whole-genome tiling array analysis of Mycobacterium leprae RNA Reveals High Expression of Pseudogenes and Noncoding Regions,2009,Journal of Bacteriology,191,10,,3321,3327,,3,http://www.scopus.com/inward/record.url?eid=2-s2.0-65549102914&partnerID=40&md5=646a8e51c978044ebb050afa08a80e1e,,219193,,JOBAA,10.1128/JB.00120-09,19286800,Journal of Bacteriology,Article,Scopus"Azad P., Zhou D., Russo E., Haddad G.G.",Distinct mechanisms underlying tolerance to intermittent and constant hypoxia in Drosophila melanogaster,2009,PLoS ONE,4,4, e5371,,,,2,http://www.scopus.com/inward/record.url?eid=2-s2.0-65549159551&partnerID=40&md5=2a87a9df1ab618a4c3ec17e56e8e8ef4,,19326203,,,10.1371/journal.pone.0005371,19401761,PLoS ONE,Article,Scopus"Lewis J.A., Szilagyi M., Gehman E., Dennis W.E., Jackson D.A.",Distinct patterns of gene and protein expression elicited by organophosphorus pesticides in Caenorhabditis elegans,2009,BMC Genomics,10,,202,,,,1,http://www.scopus.com/inward/record.url?eid=2-s2.0-66749137523&partnerID=40&md5=ccb1f9240944cd8172b9c7adc23f3a63,,14712164,,BGMEE,10.1186/1471-2164-10-202,19402892,BMC Genomics,Article,Scopus"Liang J., Parchaliuk D., Medina S., Sorensen G., Landry L., Huang S., Wang M., Kong Q., Booth S.A.",Activation of p53-regulated pro-apoptotic signaling pathways in PrP-mediated myopathy,2009,BMC Genomics,10,,201,,,,,http://www.scopus.com/inward/record.url?eid=2-s2.0-65849350635&partnerID=40&md5=05401f1d2407d274c480317028e30703,,14712164,,BGMEE,10.1186/1471-2164-10-201,19400950,BMC Genomics,Article,Scopus"Gamper M., Viereck V., Geissbuhler V., Eberhard J., Binder J., Moll C., Rehrauer H., Moser R.",Gene expression profile of bladder tissue of patients with ulcerative interstitial cystitis,2009,BMC Genomics,10,,199,,,,,http://www.scopus.com/inward/record.url?eid=2-s2.0-66349094851&partnerID=40&md5=95f0d89589e0d93bc7c1b37c8aa9807a,,14712164,,BGMEE,10.1186/1471-2164-10-199,19400928,BMC Genomics,Article,Scopus"Bastonero S., Le Priol Y., Armand M., Bernard C.S., Reynaud-Gaubert M., Olive D., Parzy D., de Bentzmann S., Capo C., Mege J.-L.",New microbicidal functions of tracheal glands: Defective anti-infectious response to Pseudomonas aeruginosa in cystic fibrosis,2009,PLoS ONE,4,4, e5357,,,,1,http://www.scopus.com/inward/record.url?eid=2-s2.0-65449186601&partnerID=40&md5=9cd85f0b40654a545f474b5c66516f2c,,19326203,,,10.1371/journal.pone.0005357,19399182,PLoS ONE,Article,Scopus"Nobre L.S., Al-Shahrour F., Dopazo J., Saraiva L.M.",Exploring the antimicrobial action of a carbon monoxide-releasing compound through whole-genome transcription profiling of Escherichia coli,2009,Microbiology,155,3,,813,824,,1,http://www.scopus.com/inward/record.url?eid=2-s2.0-64049087476&partnerID=40&md5=52e73f4e29e675a958f8917c8fad72e9,,13500872,,MROBE,10.1099/mic.0.023911-0,19246752,Microbiology,Article,Scopus"Bigot A., Raynaud C., Dubail I., Dupuis M., Hossain H., Hain T., Chakraborty T., Charbit A.","Imo1273, a novel gene involved in Listeria monocytogenes virulence",2009,Microbiology,155,3,,891,902,,,http://www.scopus.com/inward/record.url?eid=2-s2.0-64049094736&partnerID=40&md5=d0de21d71b2652dac5add68c4fd5eba7,,13500872,,MROBE,10.1099/mic.0.022277-0,19246760,Microbiology,Article,Scopus"Sideri T.C., Willetts S.A., Avery S.V.",Methionine sulphoxide reductases protect iron-sulphur clusters from oxidative inactivation in yeast,2009,Microbiology,155,2,,612,623,,1,http://www.scopus.com/inward/record.url?eid=2-s2.0-62249136392&partnerID=40&md5=8e7420ed2391b260b4094f4dd6e632df,,13500872,,MROBE,10.1099/mic.0.022665-0,19202110,Microbiology,Article,Scopus"Chelh I., Meunier B., Picard B., Reecy M.J., Chevalier C., Hocquette J.-F., Cassar-Malek I.",Molecular profiles of Quadriceps muscle in myostatin-null mice reveal PI3K and apoptotic pathways as myostatin targets,2009,BMC Genomics,10,,196,,,,3,http://www.scopus.com/inward/record.url?eid=2-s2.0-66049084853&partnerID=40&md5=d8053ebda6bd69bfef970da0c781182c,,14712164,,BGMEE,10.1186/1471-2164-10-196,19397818,BMC Genomics,Article,Scopus"Gooderham W.J., Gellatly S.L., Sanschagrin F., McPhee J.B., Bains M., Cosseau C., Levesque R.C., Hancock R.E.W.",The sensor kinase PhoQ mediates virulence in Pseudomonas aeruginosa,2009,Microbiology,155,3,,699,711,,5,http://www.scopus.com/inward/record.url?eid=2-s2.0-64049100831&partnerID=40&md5=c3c5d94f43866910554a6ff8d7e311e3,,13500872,,MROBE,10.1099/mic.0.024554-0,19246741,Microbiology,Article,Scopus"Uzarowska A., Dionisio G., Sarholz B., Piepho H.-P., Xu M., Ingvardsen C.R., Wenzel G., Lbberstedt T.",Validation of candidate genes putatively associated with resistance to SCMV and MDMV in maize (Zea mays L.) by expression profiling,2009,BMC Plant Biology,9,,15,,,,2,http://www.scopus.com/inward/record.url?eid=2-s2.0-65249090837&partnerID=40&md5=4f6cc83edcf89f4323aaa655fc3c888d,,14712229,,,10.1186/1471-2229-9-15,19187556,BMC Plant Biology,Article,Scopus"Ellison T.J., Izumiya Y., Izumiya C., Luciw P.A., Kung H.-J.",A comprehensive analysis of recruitment and transactivation potential of K-Rta and K-bZIP during reactivation of Kaposi's sarcoma-associated herpesvirus,2009,Virology,387,1,,76,88,,4,http://www.scopus.com/inward/record.url?eid=2-s2.0-63549108515&partnerID=40&md5=b08e39fd8f075ed3d19aef18103d8602,,426822,,VIRLA,10.1016/j.virol.2009.02.016,19269659,Virology,Article,Scopus"Rodriguez-Osorio N., Wang Z., Kasinathan P., Page G.P., Robl J.M., Memili E.",Transcriptional reprogramming of gene expression in bovine somatic cell chromatin transfer embryos,2009,BMC Genomics,10,,190,,,,1,http://www.scopus.com/inward/record.url?eid=2-s2.0-65649126673&partnerID=40&md5=1de69d1e6b597af0a32f84e604328805,,14712164,,BGMEE,10.1186/1471-2164-10-190,19393066,BMC Genomics,Article,Scopus"Badot V., Galant C., Toukap A.N., Theate I., Maudoux A.-L., Van den Eynde B.J., Durez P., Houssiau F.A., Lauwerys B.R.",Gene expression profiling in the synovium identifies a predictive signature of absence of response to adalimumab therapy in rheumatoid arthritis,2009,Arthritis Research and Therapy,11,2, R57,,,,1,http://www.scopus.com/inward/record.url?eid=2-s2.0-65549157167&partnerID=40&md5=788245b5e14b530eaeeece2eac1fd0e8,,14786354,,ARTRC,10.1186/ar2678,19389237,Arthritis Research and Therapy,Article,Scopus"Gokce O., Rurine H., Kuhn A., Luthi-Carter R.",Short-term striatal gene expression responses to brain-derived neurotrophic factor are dependent on MEK and ERK activation,2009,PLoS ONE,4,4, e5292,,,,2,http://www.scopus.com/inward/record.url?eid=2-s2.0-65449167971&partnerID=40&md5=f62336dbee068153d37637111d179ed3,,19326203,,,10.1371/journal.pone.0005292,19390590,PLoS ONE,Article,Scopus"Yin M., Liu S., Yin Y., Li S., Li Z., Wu X., Zhang B., Ang S.-L., Ding Y., Zhou J.",Ventral mesencephalon-enriched genes that regulate the development of dopaminemic neurons in vivo,2009,Journal of Neuroscience,29,16,,5170,5182,,2,http://www.scopus.com/inward/record.url?eid=2-s2.0-65549155389&partnerID=40&md5=fa75cc0c71dc16710daef29ecb2a3d7e,,2706474,,JNRSD,10.1523/JNEUROSCI.5569-08.2009,19386913,Journal of Neuroscience,Article,Scopus"Zheng J., Chen Y., Pat B., Dell'Italia D.L.A., Tillson M., Dillon A.R., Powell P.C., Shi K., Shah N., Denney T., Husain A., Dell'Italia L.J.",Molecular cardiology microarray identifies extensive downregulation of noncollagen extracellular matrix and profibrotic growth factor genes in chronic isolated mitral regurgitation in the dog,2009,Circulation,119,15,,2086,2095,,2,http://www.scopus.com/inward/record.url?eid=2-s2.0-65449142922&partnerID=40&md5=e15aea2f5fa6af8a2baf4f019c088fe9,,97322,,CIRCA,10.1161/CIRCULATIONAHA.108.826230,19349319,Circulation,Article,Scopus"Koziel J., Maciag-Gudowska A., Mikolajczyk T., Bzowska M., Sturdevant D.E., Whitney A.R., Shaw L.N., DeLeo F.R., Potempa J.",Phagocytosis of Staphylococcus aureus by macrophages exerts cytoprotective effects manifested by the upregulation of antiapoptotic factors,2009,PLoS ONE,4,4, e5210,,,,1,http://www.scopus.com/inward/record.url?eid=2-s2.0-65349084974&partnerID=40&md5=270977dc43e2109d088c5ecdd1314306,,19326203,,,10.1371/journal.pone.0005210,19381294,PLoS ONE,Article,Scopus"Feng Y., Valley M.T., Lazar J., Yang A.L., Bronson R.T., Firestein S., Coetzee W.A., Manley J.L.",SRp38 Regulates Alternative Splicing and Is Required for Ca<sup>2+</sup> Handling in the Embryonic Heart,2009,Developmental Cell,16,4,,528,538,,2,http://www.scopus.com/inward/record.url?eid=2-s2.0-64549159302&partnerID=40&md5=8edc90df04e06f13d53aeffa9bf41d39,,15345807,,DCEEB,10.1016/j.devcel.2009.02.009,19386262,Developmental Cell,Article,Scopus"Nguyen C.Q., Sharma A., Lee B.H., She J.-X., McIndoe R.A., Peck A.B.",Differential gene expression in the salivary gland during development and onset of xerostomia in Sjögren's syndrome-like disease of the C57BL/6.NOD-Aec1Aec2 mouse,2009,Arthritis Research and Therapy,11,2, R56,,,,,http://www.scopus.com/inward/record.url?eid=2-s2.0-65549089132&partnerID=40&md5=ef3af74422f9aeae90cf43532100ac0f,,14786354,,ARTRC,10.1186/ar2676,19379516,Arthritis Research and Therapy,Article,Scopus"Fraser J., Rousseau M., Shenker S., Ferraiuolo M.A., Hayashizaki Y., Blanchette M., Dostie J.",Chromatin conformation signatures of cellular differentiation,2009,Genome Biology,10,4, R37,,,,,http://www.scopus.com/inward/record.url?eid=2-s2.0-65149100263&partnerID=40&md5=9628c54d9affb4d0680e4024acca21fc,,14747596,,GNBLF,10.1186/gb-2009-10-4-r37,19374771,Genome Biology,Article,Scopus"Kawaji H., Severin J., Lizio M., Waterhouse A., Katayama S., Irvine K.M., Hume D.A., Forrest A.R.R., Suzuki H., Carninci P., Hayashizaki Y., Daub C.O.",The FANTOM web resource: From mammalian transcriptional landscape to its dynamic regulation,2009,Genome Biology,10,4, R40,,,,4,http://www.scopus.com/inward/record.url?eid=2-s2.0-65549128370&partnerID=40&md5=2690f3104ee4a949ca0624dba1b6364c,,14747596,,GNBLF,10.1186/gb-2009-10-4-r40,19374775,Genome Biology,Article,Scopus"Tian Z., Palmer N., Schmid P., Yao H., Galdzicki M., Berger B., Wu E., Kohane I.S.",A practical platform for blood biomarker study by using global gene expression profiling of peripheral whole blood,2009,PLoS ONE,4,4, e5157,,,,2,http://www.scopus.com/inward/record.url?eid=2-s2.0-65449163005&partnerID=40&md5=2f661dc18ae9f3e01f3f68ed151121f8,,19326203,,,10.1371/journal.pone.0005157,19381341,PLoS ONE,Article,Scopus"Kino T., Manoli I., Kelkar S., Wang Y., Su Y.A., Chrousos G.P.","Glucocorticoid receptor (GR) β has intrinsic, GRα-independent transcriptional activity",2009,Biochemical and Biophysical Research Communications,381,4,,671,675,,3,http://www.scopus.com/inward/record.url?eid=2-s2.0-62949138967&partnerID=40&md5=570ba39b36a777f5bff0f80fa729369d,,0006291X,,BBRCA,10.1016/j.bbrc.2009.02.110,19248771,Biochemical and Biophysical Research Communications,Article,Scopus"Tsuda M., Inoue-Narita T., Suzuki A., Itami S., Blumenberg M., Manabe M.",Induction of gene encoding FABP4 in Pten-null keratinocytes,2009,FEBS Letters,583,8,,1319,1322,,,http://www.scopus.com/inward/record.url?eid=2-s2.0-64049092049&partnerID=40&md5=77db220eead7a8981e5b1b0b516b8525,,145793,,FEBLA,10.1016/j.febslet.2009.03.030,19303874,FEBS Letters,Article,Scopus"Kitagaki H., Cowart L.A., Matmati N., Montefusco D., Gandy J., de Avalos S.V., Novgorodov S.A., Zheng J., Obeid L.M., Hannun Y.A.",ISC1-dependent metabolic adaptation reveals an indispensable role for mitochondria in induction of nuclear genes during the diauxic shift in Saccharomyces cerevisiae,2009,Journal of Biological Chemistry,284,16,,10818,10830,,1,http://www.scopus.com/inward/record.url?eid=2-s2.0-67449084913&partnerID=40&md5=05a3048b5a9c3143ffcf17ca19f24c76,,219258,,JBCHA,10.1074/jbc.M805029200,19179331,Journal of Biological Chemistry,Article,Scopus"Abukawa H., Tomi M., Kiyokawa J., Hori S., Kondo T., Terasaki T., Hosoya K.",Modulation of retinal capillary endothelial cells by Müller glial cell-derived factors.,2009,Molecular vision,15,,,451,457,,,http://www.scopus.com/inward/record.url?eid=2-s2.0-64349088284&partnerID=40&md5=d98ab7daebafffbb0f49564397d98bdd,,10900535,,,,19247458,Molecular vision,Article,Scopus"Rada J.A.S., Wiechmann A.F.",Ocular expression of avian thymic hormone: Changes during the recovery from induced myopia,2009,Molecular Vision,15,,,778,792,,,http://www.scopus.com/inward/record.url?eid=2-s2.0-65349165751&partnerID=40&md5=258b2339c00243b41aea5d00cbbfd2ae,,10900535,,MVEPF,,19390653,Molecular Vision,Article,Scopus"Kim J.-H., Zhao Y., Pan X., He X., Gilbert H.F.",The unfolded protein response is necessary but not sufficient to compensate for defects in disulfide isomerization,2009,Journal of Biological Chemistry,284,16,,10400,10408,,,http://www.scopus.com/inward/record.url?eid=2-s2.0-67449088036&partnerID=40&md5=5ca8a0c2a7b425956576e0fd9cf06cd1,,219258,,JBCHA,10.1074/jbc.M900377200,19233841,Journal of Biological Chemistry,Article,Scopus"Fu X., Fu N., Guo S., Yan Z., Xu Y., Hu H., Menzel C., Chen W., Li Y., Zeng R., Khaitovich P.",Estimating accuracy of RNA-Seq and microarrays with proteomics,2009,BMC Genomics,10,,161,,,,2,http://www.scopus.com/inward/record.url?eid=2-s2.0-65649083411&partnerID=40&md5=8b7e0fbd65b28c8140503523afdba23e,,14712164,,BGMEE,10.1186/1471-2164-10-161,19371429,BMC Genomics,Article,Scopus