Authors,Title,Year,Source title,Volume,Issue,Art. No.,Page start,Page end,Page count,Cited by,Link,Publisher,ISSN,ISBN,CODEN,DOI,PubMed ID,Abbreviated Source Title,Document Type,Source"Spehlmann M.E., Dann S.M., Hruz P., Hanson E., McCole D.F., Eckmann L.",CXCR2-dependent mucosal neutrophil influx protects against colitis-associated diarrhea caused by an attaching/effacing lesion-forming bacterial pathogen.,2009,"Journal of immunology (Baltimore, Md. : 1950)",183,5,,3332,3343,,,http://www.scopus.com/inward/record.url?eid=2-s2.0-70349238797&partnerID=40&md5=4ad07f1656bdf8411dcf016392505f87,,15506606,,,10.4049/jimmunol.0900600,19675161,"Journal of immunology (Baltimore, Md. : 1950)",Article,Scopus"Buvanendran A., Mitchell K., Kroin J.S., Iadarola M.J.",Cytokine gene expression after total hip arthroplasty: surgical site versus circulating neutrophil response.,2009,Anesthesia and analgesia,109,3,,959,964,,,http://www.scopus.com/inward/record.url?eid=2-s2.0-70149123489&partnerID=40&md5=eb7a4e99c4b6ac07c07e036ba5b60156,,15267598,,,,19690273,Anesthesia and analgesia,Article,Scopus"Emery L.A., Tripathi A., King C., Kavanah M., Mendez J., Stone M.D., De Las Morenas A., Sebastiani P., Rosenberg C.L.",Early dysregulation of cell adhesion and extracellular matrix pathways in breast cancer progression,2009,American Journal of Pathology,175,3,,1292,1302,,,http://www.scopus.com/inward/record.url?eid=2-s2.0-70349243186&partnerID=40&md5=140f7c090aeaf8bfaa5a016a2daa6419,,29440,,AJPAA,10.2353/ajpath.2009.090115,19700746,American Journal of Pathology,Article,Scopus"Huang Z., Dore L.C., Li Z., Orkin S.H., Feng G., Lin S., Crispino J.D.",GATA-2 reinforces megakaryocyte development in the absence of GATA-1,2009,Molecular and Cellular Biology,29,18,,5168,5180,,,http://www.scopus.com/inward/record.url?eid=2-s2.0-70249123849&partnerID=40&md5=6fe421e8814c153ea568a380d4994262,,2707306,,MCEBD,10.1128/MCB.00482-09,19620289,Molecular and Cellular Biology,Article,Scopus"Abarrategi A., Garcia-Cantalejo J., Moreno-Vicente C., Civantos A., Ramos V., Casado J.V.S., Perez-Rial S., Martnez-Corria R., Lopez-Lacomba J.L.",Gene expression profile on chitosan/rhBMP-2 films: A novel osteoinductive coating for implantable materials,2009,Acta Biomaterialia,5,7,,2633,2646,,,http://www.scopus.com/inward/record.url?eid=2-s2.0-69049088738&partnerID=40&md5=2c64cea07ab055411f0848e67f27662f,,17427061,,,10.1016/j.actbio.2009.02.031,19342322,Acta Biomaterialia,Article,Scopus"Kuzman M.R., Medved V., Terzic J., Krainc D.",Genome-wide expression analysis of peripheral blood identifies candidate biomarkers for schizophrenia,2009,Journal of Psychiatric Research,43,13,,1073,1077,,,http://www.scopus.com/inward/record.url?eid=2-s2.0-68949213816&partnerID=40&md5=88256d922c04502499b93c494c06f6c1,,223956,,JPYRA,10.1016/j.jpsychires.2009.03.005,19358997,Journal of Psychiatric Research,Article,Scopus"Arora S., Husain M., Kumar D., Patni H., Pathak S., Mehrotra D., Reddy V.K., Reddy L.R., Salhan D., Yadav A., Mathieson P.W., Saleem M.A., Chander P.N., Singhal P.C.",Human immunodeficiency virus downregulates podocyte apoE expression,2009,American Journal of Physiology - Renal Physiology,297,3,,,,,,http://www.scopus.com/inward/record.url?eid=2-s2.0-69449089082&partnerID=40&md5=aa9442e06b7cf38c5845d6f7228b9656,,3636127,,AJPPF,10.1152/ajprenal.90668.2008,19553347,American Journal of Physiology - Renal Physiology,Article,Scopus"Pakalapati G., Li L., Gretz N., Koch E., Wink M.",Influence of red clover (Trifolium pratense) isoflavones on gene and protein expression profiles in liver of ovariectomized rats,2009,Phytomedicine,16,9,,845,855,,1,http://www.scopus.com/inward/record.url?eid=2-s2.0-65549117159&partnerID=40&md5=03b4c44f6a5c1d249bdfd6d22b78a297,,9447113,,PYTOE,10.1016/j.phymed.2009.03.003,19409770,Phytomedicine,Article,Scopus"Mochimaru H., Takahashi E., Tsukamoto N., Miyazaki J., Yaguchi T., Koto T., Kurihara T., Noda K., Ozawa Y., Ishimoto T., Kawakami Y., Tanihara H., Saya H., Ishida S., Tsubota K.",Involvement of hyaluronan and its receptor CD44 with choroidal neovascularization.,2009,Investigative ophthalmology & visual science,50,9,,4410,4415,,,http://www.scopus.com/inward/record.url?eid=2-s2.0-70349232405&partnerID=40&md5=b743a7765bb34fc10d089ba5d8a83b2f,,15525783,,,,19339747,Investigative ophthalmology & visual science,Article,Scopus"Cheng D., He J.","Isolation and characterization of ""Dehalococcoides"" sp. strain MB, which dechlorinates tetrachloroethene to trans-1,2-dichloroethene",2009,Applied and Environmental Microbiology,75,18,,5910,5918,,1,http://www.scopus.com/inward/record.url?eid=2-s2.0-70149123013&partnerID=40&md5=d2109140a49d5c82bf90c6c4c8f5868f,,992240,,AEMID,10.1128/AEM.00767-09,19633106,Applied and Environmental Microbiology,Article,Scopus"Ruggiero T., Trabucchi M., De Santa F., Zupo S., Harfe B.D., McManus M.T., Rosenfeld M.G., Briata P., Gherzi R.",LPS induces KH-type splicing regulatory protein-dependent processing of microRNA-155 precursors in macrophages,2009,FASEB Journal,23,9,,2898,2908,,2,http://www.scopus.com/inward/record.url?eid=2-s2.0-70349323601&partnerID=40&md5=caec687dda91d85bfa4aa5366b08327b,,8926638,,FAJOE,10.1096/fj.09-131342,19423639,FASEB Journal,Article,Scopus"Rome S., Meugnier E., Lecomte V., Berbe V., Besson J., Cerutti C., Pesenti S., Granjon A., Disse E., Clement K., Lefai E., Laville M., Vidal H.","Microarray analysis of genes with impaired insulin regulation in the skeletal muscle of type 2 diabetic patients indicates the involvement of basic helix-loop-helix domain-containing, class B, 2 protein (BHLHB2)",2009,Diabetologia,52,9,,1899,1912,,1,http://www.scopus.com/inward/record.url?eid=2-s2.0-68449087392&partnerID=40&md5=b675984986f206a9cab5efb2306ac517,,0012186X,,DBTGA,10.1007/s00125-009-1442-4,19590847,Diabetologia,Article,Scopus"Vanoirbeek E., Eelen G., Verlinden L., Marchal K., Engelen K., De Moor B., Beullens I., Marcelis S., De Clercq P., Bouillon R., Verstuyf A.","Microarray analysis of MCF-7 breast cancer cells treated with 1,25-dihydroxyvitamin D<sub>3</sub> or a 17-methyl-D-ring analog",2009,Anticancer Research,29,9,,3585,3590,,,http://www.scopus.com/inward/record.url?eid=2-s2.0-68549118799&partnerID=40&md5=c0a65c215a60c91ad41e37ffcdd7fee4,,2507005,,ANTRD,,19667152,Anticancer Research,Conference Paper,Scopus"Navarro A., Bea S., Fernandez V., Prieto M., Salaverria I., Jares P., Hartmann E., Mozos A., Lopez-Guillermo A., Villamor N., Colomer D., Puig X., Ott G., Sole F., Serrano S., Rosenwald A., Campo E., Hernandez L.","MicroRNA expression, chromosomal alterations, and immunoglobulin variable heavy chain hypermutations in mantle cell lymphomas",2009,Cancer Research,69,17,,7071,7078,,1,http://www.scopus.com/inward/record.url?eid=2-s2.0-70149118546&partnerID=40&md5=9054fe46fb54783c74c36381e2567df0,,85472,,CNREA,10.1158/0008-5472.CAN-09-1095,19690137,Cancer Research,Article,Scopus"Ritland Politz J.C., Hogan E.M., Pederson T.",MicroRNAs with a nucleolar location,2009,RNA,15,9,,1705,1715,,1,http://www.scopus.com/inward/record.url?eid=2-s2.0-69049118109&partnerID=40&md5=3ea7d9f8937a3fd27cb92661d44f79d7,,13558382,,RNARF,10.1261/rna.1470409,19628621,RNA,Article,Scopus"Akinci M.A., Turner H., Taveras M., Barash A., Wang Z., Reinach P., Wolosin J.M.",Molecular profiling of conjunctival epithelial side-population stem cells: atypical cell surface markers and sources of a slow-cycling phenotype.,2009,Investigative ophthalmology & visual science,50,9,,4162,4172,,,http://www.scopus.com/inward/record.url?eid=2-s2.0-70349237074&partnerID=40&md5=48d0eed2f72477364fa79328ec3a1c7c,,15525783,,,,19324848,Investigative ophthalmology & visual science,Article,Scopus"Brauch K.M., Karst M.L., Herron K.J., de Andrade M., Pellikka P.A., Rodeheffer R.J., Michels V.V., Olson T.M.",Mutations in Ribonucleic Acid Binding Protein Gene Cause Familial Dilated Cardiomyopathy,2009,Journal of the American College of Cardiology,54,10,,930,941,,1,http://www.scopus.com/inward/record.url?eid=2-s2.0-68949191192&partnerID=40&md5=29d0e7a022eb2b054e6a67f6d26c4106,,7351097,,JACCD,10.1016/j.jacc.2009.05.038,19712804,Journal of the American College of Cardiology,Article,Scopus"Song G., Wang L.",Nuclear receptor SHP activates miR-206 expression via a cascade dual inhibitory mechanism,2009,PLoS ONE,4,9, e6880,,,,,http://www.scopus.com/inward/record.url?eid=2-s2.0-70149105707&partnerID=40&md5=54b008730be37b337bfaf36a8d83db83,,19326203,,,10.1371/journal.pone.0006880,19721712,PLoS ONE,Article,Scopus"Fuhrman L.E., Goel A.K., Smith J., Shianna K.V., Aballay A.",Nucleolar proteins suppress Caenorhabditis elegans innate immunity by inhibiting p53/CEP-1,2009,PLoS Genetics,5,9, e1000657,,,,,http://www.scopus.com/inward/record.url?eid=2-s2.0-70349668990&partnerID=40&md5=f5b479f992e87c92bee9793f1d28274f,,15537390,,,10.1371/journal.pgen.1000657,19763173,PLoS Genetics,Article,Scopus"Visser W.E., Heemstra K.A., Swagemakers S.M.A., Ozgur Z., Corssmit E.P., Burggraaf J., Van Ijcken W.F.J., Van Der Spek P.J., Smit J.W.A., Visser T.J.",Physiological thyroid hormone levels regulate numerous skeletal muscle transcripts,2009,Journal of Clinical Endocrinology and Metabolism,94,9,,3487,3496,,2,http://www.scopus.com/inward/record.url?eid=2-s2.0-69949088467&partnerID=40&md5=f0d22757f73e70604b9fe0a546aa68cd,,0021972X,,JCEMA,10.1210/jc.2009-0782,19567520,Journal of Clinical Endocrinology and Metabolism,Article,Scopus"Berkofsky-Fessler W., Nguyen T.Q., Delmar P., Molnos J., Kanwal C., DePinto W., Rosinski J., McLoughlin P., Ritland S., DeMario M., Tobon K., Reidhaar-Olson J.F., Rueger R., Hilton H.",Preclinical biomarkers for a cyclin-dependent kinase inhibitor translate to candidate pharmacodynamic biomarkers in phase I patients,2009,Molecular Cancer Therapeutics,8,9,,2517,2525,,,http://www.scopus.com/inward/record.url?eid=2-s2.0-70349499021&partnerID=40&md5=dcdabc802df9357c07475561e3cf06c4,,15357163,,MCTOC,10.1158/1535-7163.MCT-09-0083,19755512,Molecular Cancer Therapeutics,Article,Scopus"Pretorius L., Du X.-J., Woodcock E.A., Kiriazis H., Lin R.C.Y., Marasco S., Medcalf R.L., Ming Z., Head G.A., Joon W.T., Cemerlang N., Sadoshima J., Shioi T., Izumo S., Lukoshkova E.V., Dart A.M., Jennings G.L., McMullen J.R.",Reduced phosphoinositide 3-kinase (p110α) activation increases the susceptibility to atrial fibrillation,2009,American Journal of Pathology,175,3,,998,1009,,,http://www.scopus.com/inward/record.url?eid=2-s2.0-70349309772&partnerID=40&md5=a6e40c0c942dcbd0c02dd026568ba82b,,29440,,AJPAA,10.2353/ajpath.2009.090126,19679877,American Journal of Pathology,Article,Scopus"Li J., Campbell J.S., Mitchell C., McMahan R.S., Yu X., Riehle K.J., Bumgarner R.E., Fausto N.",Relationships between deficits in tissue mass and transcriptional programs after partial hepatectomy in mice,2009,American Journal of Pathology,175,3,,947,957,,,http://www.scopus.com/inward/record.url?eid=2-s2.0-70349240362&partnerID=40&md5=edd4e7a1340c52510552f8b74068a090,,29440,,AJPAA,10.2353/ajpath.2009.090043,19700759,American Journal of Pathology,Article,Scopus"Izzotti A., Calin G.A., Steele V.E., Croce C.M., De Flora S.",Relationships of microRNA expression in mouse lung with age and exposure to cigarette smoke and light,2009,FASEB Journal,23,9,,3243,3250,,,http://www.scopus.com/inward/record.url?eid=2-s2.0-70349315533&partnerID=40&md5=051b323bf5f711fc9d1af91082f6cb9b,,8926638,,FAJOE,10.1096/fj.09-135251,19465468,FASEB Journal,Article,Scopus"Wang C.-T., Zhang P., Wang Y.-S., Ruan X.-Z., Li Z.-Y., Peng F., Yang H.-S., Wei Y.-Q.","RNA interference against Biot2, a novel mouse testis - Specific gene, inhibits the growth of tumor cells",2009,Cellular and Molecular Biology Letters,14,3,,363,376,,,http://www.scopus.com/inward/record.url?eid=2-s2.0-70349567899&partnerID=40&md5=6d26dafc45861145dfe367d5e5a65962,,14258153,,CMBLF,10.2478/s11658-009-0004-6,19277478,Cellular and Molecular Biology Letters,Article,Scopus"Ma K., Xiao J., Li X., Zhang Q., Lian X.",Sequence and expression analysis of the C3HC4-type RING finger gene family in rice,2009,Gene,444,2-Jan,,33,45,,,http://www.scopus.com/inward/record.url?eid=2-s2.0-67649873095&partnerID=40&md5=9f8279e36b86eb51cffbbb5f6e3dfa3f,,3781119,,GENED,10.1016/j.gene.2009.05.018,19523506,Gene,Article,Scopus"Klover P., Chen W., Zhu B.-M., Hennighausen L.",Skeletal muscle growth and fiber composition in mice are regulated through the transcription factors STAT5a/b: Linking growth hormone to the androgen receptor,2009,FASEB Journal,23,9,,3140,3148,,,http://www.scopus.com/inward/record.url?eid=2-s2.0-70349315535&partnerID=40&md5=8efe770a6e41d350913dc3c52b6eb5b3,,8926638,,FAJOE,10.1096/fj.08-128215,19417088,FASEB Journal,Article,Scopus"Im S.-S., Hammond L.E., Yousef L., Nugas-Selby C., Shin D.-J., Seo Y.-K., Fong L.G., Young S.G., Osborne T.F.",Sterol regulatory element binding protein 1a regulates hepatic fatty acid partitioning by activating acetyl coenzyme A carboxylase 2,2009,Molecular and Cellular Biology,29,17,,4864,4872,,,http://www.scopus.com/inward/record.url?eid=2-s2.0-68849091864&partnerID=40&md5=128f105ea8b1af59abaef298645e08c1,,2707306,,MCEBD,10.1128/MCB.00553-09,19564420,Molecular and Cellular Biology,Article,Scopus"Woodruff P.G., Modrek B., Choy D.F., Jia G., Abbas A.R., Ellwanger A., Arron J.R., Koth L.L., Fahy J.V.",T-helper type 2-driven inflammation defines major subphenotypes of asthma,2009,American Journal of Respiratory and Critical Care Medicine,180,5,,388,395,,9,http://www.scopus.com/inward/record.url?eid=2-s2.0-69249150516&partnerID=40&md5=b7731a989171770bcb87237350d2c728,,1073449X,,AJCME,10.1164/rccm.200903-0392OC,19483109,American Journal of Respiratory and Critical Care Medicine,Article,Scopus"Aslam A., Mittal S., Koch F., Andrau J.-C., Sebastiaan Winkler G.",The Ccr4-not deadenylase subunits CNOT7 and CNOT8 have overlapping roles and modulate cell proliferation,2009,Molecular Biology of the Cell,20,17,,3840,3850,,1,http://www.scopus.com/inward/record.url?eid=2-s2.0-70349337771&partnerID=40&md5=993b80bddd8fa15d5f91fb499ec7d683,,10591524,,MBCEE,10.1091/mbc.E09-02-0146,19605561,Molecular Biology of the Cell,Article,Scopus"Von Plehwe U., Berndt U., Conz C., Chiabudini M., Fitzke E., Sickmann A., Petersen A., Pfeifer D., Rospert S.",The Hsp70 homolog Ssb is essential for glucose sensing via the SNF1 kinase network,2009,Genes and Development,23,17,,2102,2115,,,http://www.scopus.com/inward/record.url?eid=2-s2.0-69749111488&partnerID=40&md5=9410215e576addbac67ec6aa435f36d6,,8909369,,GEDEE,10.1101/gad.529409,19723765,Genes and Development,Article,Scopus"Pihlajamaki J., Boes T., Kim E.-Y., Dearie F., Kim B.W., Schroeder J., Mun E., Nasser I., Park P.J., Bianco A.C., Goldfine A.B., Patti M.E.",Thyroid hormone-related regulation of gene expression in human fatty liver,2009,Journal of Clinical Endocrinology and Metabolism,94,9,,3521,3529,,,http://www.scopus.com/inward/record.url?eid=2-s2.0-69949111082&partnerID=40&md5=936ff24ab45987b2c3346cf732afb102,,0021972X,,JCEMA,10.1210/jc.2009-0212,19549744,Journal of Clinical Endocrinology and Metabolism,Article,Scopus"Zagorski J., Obraztsova M., Gellar M.A., Kline J.A., Watts J.A.",Transcriptional changes in right ventricular tissues are enriched in the outflow tract compared with the apex during chronic pulmonary embolism in rats,2009,Physiological Genomics,39,1,,61,71,,,http://www.scopus.com/inward/record.url?eid=2-s2.0-70349140116&partnerID=40&md5=b6cf5d0de8f5c08f118fe2283858c1d0,,10948341,,PHGEF,10.1152/physiolgenomics.00076.2009,19602618,Physiological Genomics,Article,Scopus"Majji S., Thodima V., Sample R., Whitley D., Deng Y., Mao J., Chinchar V.G.","Transcriptome analysis of Frog virus 3, the type species of the genus Ranavirus, family Iridoviridae",2009,Virology,391,2,,293,303,,,http://www.scopus.com/inward/record.url?eid=2-s2.0-68549134924&partnerID=40&md5=8dca9cf063592f915dfa572149dcef10,,426822,,VIRLA,10.1016/j.virol.2009.06.022,19608212,Virology,Article,Scopus"Liu Y.-F., Zha B.-S., Zhang H.-L., Zhu X.-J., Li Y.-H., Zhu J., Guan X.-H., Zhang J.-P.",Characteristic gene expression profiles in the progression from liver cirrhosis to carcinoma induced by diethylnitrosamine in a rat model,2009,Journal of Experimental and Clinical Cancer Research,28,1,107,,,,,http://www.scopus.com/inward/record.url?eid=2-s2.0-69249107364&partnerID=40&md5=ac4362e53c1b5b796a8a77c3ef7dc686,,17569966,,JECRD,10.1186/1756-9966-28-107,19638242,Journal of Experimental and Clinical Cancer Research,Article,Scopus"Green R.M., Gally F., Keeney J.G., Alper S., Gao B., Han M., Martin R.J., Weinberger A.R., Case S.R., Minor M.N., Chu H.W.",Impact of cigarette smoke exposure on innate immunity: A Caenorhabditis elegans model,2009,PLoS ONE,4,8, e6860,,,,1,http://www.scopus.com/inward/record.url?eid=2-s2.0-69949166999&partnerID=40&md5=50adeae1aa3581031d943a9531e4f074,,19326203,,,10.1371/journal.pone.0006860,19718433,PLoS ONE,Article,Scopus"Carpenter J., Hutter S., Baines J.F., Roller J., Saminadin-Peter S.S., Parsch J., Jiggins F.M.",The transcriptional response of Drosophila melanogaster to infection with the sigma virus (Rhabdoviridae),2009,PLoS ONE,4,8, e6838,,,,,http://www.scopus.com/inward/record.url?eid=2-s2.0-69949139908&partnerID=40&md5=f99dcbce25e0464a7907a67a10645d6c,,19326203,,,10.1371/journal.pone.0006838,19718442,PLoS ONE,Article,Scopus"Bronner I.F., Bochdanovits Z., Rizzu P., Kamphorst W., Ravid R., van Swieten J.C., Heutink P.",Comprehensive mRNA expression profiling distinguishes tauopathies and identifies shared molecular pathways,2009,PLoS ONE,4,8, e6826,,,,,http://www.scopus.com/inward/record.url?eid=2-s2.0-69949083603&partnerID=40&md5=95a14cb6eee62b06b4427574e8a614f6,,19326203,,,10.1371/journal.pone.0006826,19714246,PLoS ONE,Article,Scopus"Meng B., Zhu S., Li S., Zeng Q., Mei B.",Global view of the mechanisms of improved learning and memory capability in mice with music-exposure by microarray,2009,Brain Research Bulletin,80,2-Jan,,36,44,,,http://www.scopus.com/inward/record.url?eid=2-s2.0-67650756422&partnerID=40&md5=e22b66da4a80e8f553331a4fe86db7fe,,3619230,,BRBUD,10.1016/j.brainresbull.2009.05.020,19486929,Brain Research Bulletin,Article,Scopus"Altirriba J., Barbera A., Del Zotto H., Nadal B., Piquer S., Sanchez-Pla A., Gagliardino J.J., Gomis R.",Molecular mechanisms of tungstate-induced pancreatic plasticity: A transcriptomics approach,2009,BMC Genomics,10,,1471,406,,,,http://www.scopus.com/inward/record.url?eid=2-s2.0-70349570750&partnerID=40&md5=6c87521e988b705410afe286e50585af,,14712164,,BGMEE,10.1186/1471-2164-10-406,19715561,BMC Genomics,Article,Scopus"Chen Y., Gelfond J.A.L., McManus L.M., Shireman P.K.",Reproducibility of quantitative RT-PCR array in miRNA expression profiling and comparison with microarray analysis,2009,BMC Genomics,10,,1471,407,,,,http://www.scopus.com/inward/record.url?eid=2-s2.0-70349671437&partnerID=40&md5=99ba43f9438fc8d9d2def9c1a0cdf64a,,14712164,,BGMEE,10.1186/1471-2164-10-407,19715577,BMC Genomics,Article,Scopus"Tan J., Lu J., Huang W., Dong Z., Kong C., Li L., Gao L., Guo J., Huang B.",Genome-wide analysis of histone H3 lysine9 modifications in human mesenchymal stem cell osteogenic differentiation,2009,PLoS ONE,4,8, e6792,,,,,http://www.scopus.com/inward/record.url?eid=2-s2.0-69449102520&partnerID=40&md5=4f3b13eeaf61511136c3e5b0862394b7,,19326203,,,10.1371/journal.pone.0006792,19710927,PLoS ONE,Article,Scopus"Teixeira V.H., Olaso R., Martin-Magniette M.-L., Lasbleiz S., Jacq L., Oliveira C.R., Hilliquin P., Gut I., Cornelis F., Petit-Teixeira E.",Transcriptome analysis describing new immunity and defense genes in peripheral blood mononuclear cells of rheumatoid arthritis patients,2009,PLoS ONE,4,8, e6803,,,,,http://www.scopus.com/inward/record.url?eid=2-s2.0-69449103609&partnerID=40&md5=3743e50ad1c48278c6cc5d90f81c1800,,19326203,,,10.1371/journal.pone.0006803,19710928,PLoS ONE,Article,Scopus"Bheda A., Shackelford J., Pagano J.S.",Expression and functional studies of ubiquitin C-terminal hydrolase L1 regulated genes,2009,PLoS ONE,4,8, e6764,,,,1,http://www.scopus.com/inward/record.url?eid=2-s2.0-69849091168&partnerID=40&md5=e90eb49b592362e47a8cac1611ff74b7,,19326203,,,10.1371/journal.pone.0006764,19707515,PLoS ONE,Article,Scopus"Tavenet A., Suleau A., Dubreuil G., Ferrari R., Ducrot C., Michaut M., Aude J.-C., Dieci G., Lefebvre O., Conesa C., Acker J.",Genome-wide location analysis reveals a role for Sub1 in RNA polymerase III transcription,2009,Proceedings of the National Academy of Sciences of the United States of America,106,34,,14265,14270,,,http://www.scopus.com/inward/record.url?eid=2-s2.0-70149096882&partnerID=40&md5=139e832157a891f10ddcb2a6637a5859,,278424,,PNASA,10.1073/pnas.0900162106,19706510,Proceedings of the National Academy of Sciences of the United States of America,Article,Scopus"Schroeckh V., Scherlach K., Nutzmann H.-W., Shelest E., Schmidt-Heck W., Schuemann J., Martin K., Hertweck C., Brakhage A.A.",Intimate bacterial-fungal interaction triggers biosynthesis of archetypal polyketides in Aspergillus nidulans,2009,Proceedings of the National Academy of Sciences of the United States of America,106,34,,14558,14563,,1,http://www.scopus.com/inward/record.url?eid=2-s2.0-70149109184&partnerID=40&md5=86d7ead177a6885b5da9f1ee3c1aca22,,278424,,PNASA,10.1073/pnas.0901870106,19666480,Proceedings of the National Academy of Sciences of the United States of America,Article,Scopus"Quatrini R., Appia-Ayme C., Denis Y., Jedlicki E., Holmes D.S., Bonnefoy V.",Extending the models for iron and sulfur oxidation in the extreme Acidophile Acidithiobacillus ferrooxidans,2009,BMC Genomics,10,,1471,394,,,,http://www.scopus.com/inward/record.url?eid=2-s2.0-70350445731&partnerID=40&md5=6d4f21143ed8cb1e49796712b60eb284,,14712164,,BGMEE,10.1186/1471-2164-10-394,19703284,BMC Genomics,Article,Scopus"Green C.E., Liu T., Montel V., Hsiao G., Lester R.D., Subramaniam S., Gonias S.L., Klemke R.L.","Chemoattractant signaling between tumor cells and macrophages regulates cancer cell migration, metastasis and neovascularization",2009,PLoS ONE,4,8, e6713,,,,,http://www.scopus.com/inward/record.url?eid=2-s2.0-69249219322&partnerID=40&md5=54a9bba4e2d930d09c62070241f61746,,19326203,,,10.1371/journal.pone.0006713,19696929,PLoS ONE,Article,Scopus"Metsuyanim S., Harari-Steinberg O., Buzhor E., Omer D., Pode-Shakked N., Ben-Hur H., Halperin R., Schneider D., Dekel B.",Expression of stem cell markers in the human fetal kidney,2009,PLoS ONE,4,8, e6709,,,,,http://www.scopus.com/inward/record.url?eid=2-s2.0-69249219272&partnerID=40&md5=3813d95d8c8ae0e7db43d19770397767,,19326203,,,10.1371/journal.pone.0006709,19696931,PLoS ONE,Article,Scopus"Wang Y., Rathinam R., Walch A., Alahari S.K.","ST14 (suppression of tumorigenicity 14) gene is a target for miR-27b, and the inhibitory effect of ST14 on cell growth isindependent of miR-27b regulation",2009,Journal of Biological Chemistry,284,34,,23094,23106,,1,http://www.scopus.com/inward/record.url?eid=2-s2.0-69249088913&partnerID=40&md5=be1e34dbaa245b0797bc7702bea6890f,,219258,,JBCHA,10.1074/jbc.M109.012617,19546220,Journal of Biological Chemistry,Article,Scopus"Patil D.P., Atanur S., Dhotre D.P., Anantharam D., Mahajan V.S., Walujkar S.A., Chandode R.K., Kulkarni G.J., Ghate P.S., Srivastav A., Dayananda K.M., Gupta N., Bhagwat B., Joshi R.R., Mourya D.T., Patole M.S., Shouche Y.S.","Generation, annotation, and analysis of ESTs from midgut tissue of adult female Anopheles stephensi mosquitoes",2009,BMC Genomics,10,,1471,386,,,,http://www.scopus.com/inward/record.url?eid=2-s2.0-70349563337&partnerID=40&md5=56f253a3d94ed5f80e6eed6edb6faca7,,14712164,,BGMEE,10.1186/1471-2164-10-386,19695102,BMC Genomics,Article,Scopus"Silveira R.D., Alves-Ferreira M., Guimaraes L.A., Da Silva F.R., Carneiro V.T.D.C.",Selection of reference genes for quantitative real-time PCR expression studies in the apomictic and sexual grass Brachiaria brizantha,2009,BMC Plant Biology,9,,84,,,,,http://www.scopus.com/inward/record.url?eid=2-s2.0-68749118527&partnerID=40&md5=1f964107303dcc8e8b51a139b745f770,,14712229,,,10.1186/1471-2229-9-84,19573233,BMC Plant Biology,Article,Scopus"Chiu H.-C., Lin T.-L., Yang J.-C., Wang J.-T.",Synergistic effect of imp/ostA and msbA in hydrophobic drug resistance of helicobacter pylori,2009,BMC Microbiology,9,,136,,,,,http://www.scopus.com/inward/record.url?eid=2-s2.0-68749115397&partnerID=40&md5=52b0f2d501e9edc271fb4859c4cb473d,,14712180,,,10.1186/1471-2180-9-136,19594901,BMC Microbiology,Article,Scopus"Chandriani S., Frengen E., Cowling V.H., Pendergrass S.A., Perou C.M., Whitfield M.L., Cole M.D.",A core MYC gene expression signature is prominent in basal-like breast cancer but only partially overlaps the core serum response,2009,PLoS ONE,4,8, e6693,,,,,http://www.scopus.com/inward/record.url?eid=2-s2.0-68949209109&partnerID=40&md5=d81064fd17aa7a11ac95cd5aaa47ff78,,19326203,,,10.1371/journal.pone.0006693,19690609,PLoS ONE,Article,Scopus"Rezen T., Tamasi V., Lovgren-Sandblom A., Bjorkhem I., Meyer U.A., Rozman D.",Effect of CAR activation on selected metabolic pathways in normal and hyperlipidemic mouse livers,2009,BMC Genomics,10,,1471,384,,,1,http://www.scopus.com/inward/record.url?eid=2-s2.0-70349569532&partnerID=40&md5=a648fb42a2a83354a82f5313bb8988a0,,14712164,,BGMEE,10.1186/1471-2164-10-384,19691840,BMC Genomics,Article,Scopus"Nielsen J.A., Lau P., Maric D., Barker J.L., Hudson L.D.",Integrating microRNA and mRNA expression profiles of neuronal progenitors to identify regulatory networks underlying the onset of cortical neurogenesis,2009,BMC Neuroscience,10,,98,,,,,http://www.scopus.com/inward/record.url?eid=2-s2.0-69849087551&partnerID=40&md5=dda79176caeb54b1c1a009f5c8294763,,14712202,,BNMEA,10.1186/1471-2202-10-98,19689821,BMC Neuroscience,Article,Scopus